type,location,trigger,scenario,message,source_file,line,politeness,notes
live-announce,App,Live-region announcement,A live-region announcement fires during App interaction.,[text],src/renderer/App.jsx,165,assertive,see message expression
live-announce,App,Idle warning overlay appears,Visitor has been inactive for several minutes; the idle warning overlay appears and interrupts with this spoken alert.,Still there? Press any key to stay.,src/renderer/App.jsx,293,assertive,
dialog-title,App,Dialog / region labelled by this element,Visitor opens Accessibility Settings (Settings key); NVDA reads the dialog title.,Accessibility Settings,src/renderer/App.jsx,369,n/a,"id=""accessibility-settings-title"""
aria-describedby,App,"Element references id=""test-easter-egg-message"" via aria-describedby",Developer test easter egg only — not part of the public visitor experience.,{testEasterEgg.message},src/renderer/App.jsx,388,n/a,"id=""test-easter-egg-message"""
dialog-title,App,Dialog / region labelled by this element,Part of the idle-warning dialog — NVDA reads this as the dialog heading.,Still there?,src/renderer/App.jsx,406,n/a,"id=""idle-warning-title"""
aria-describedby,App,"Element references id=""idle-warning-stay"" via aria-describedby",Part of the idle-warning dialog — NVDA reads this as the dialog instructions.,Press any key to stay,src/renderer/App.jsx,417,n/a,"id=""idle-warning-stay"""
aria-describedby,AccessibilityMenu,"Element references id=""accessibility-onboarding-blurb"" via aria-describedby",First launch: visitor sees the accessibility settings onboarding dialog; NVDA reads this intro paragraph before focus moves to a button.,"By default, the screen reader is on. Press Skip to continue with these settings, or use the arrow keys to customize screen reader, speech speed, text size, contrast, or brightness. Press Q to pause or resume speech and media. Press the settings key to access this menu at any time.",src/renderer/components/AccessibilityMenu.jsx,106,n/a,"id=""accessibility-onboarding-blurb"""
aria-label,AccessibilityMenu,Element receives focus,"Right after the onboarding intro, focus lands on the Skip button and the visitor hears this follow-up instruction.","Press the Select key to stick with these settings or press the right arrow key to customize screen reader, speech speed, text size, contrast, or brightness.",src/renderer/components/AccessibilityMenu.jsx,118,n/a,
helper-fn,ArtifactPopup,Referenced by announce() or aria-label (AUTO_READ_COMPLETE_INSTRUCTION),Spoken after auto-read finishes on an artifact — tells the visitor how to keep exploring.,"Use the artifact control menu to continue exploring this artifact, or navigate to the next artifact button to go to the next artifact.",src/renderer/components/ArtifactPopup.jsx,11,n/a,constant AUTO_READ_COMPLETE_INSTRUCTION
live-announce,ArtifactPopup,Artifact popup interaction,Visitor opens an artifact; NVDA interrupts to announce the artifact title plus 'opened.',{artifact.title} opened.,src/renderer/components/ArtifactPopup.jsx,312,assertive,dynamic template
live-announce,ArtifactPopup,Artifact popup interaction,A live-region announcement fires during ArtifactPopup interaction.,[AUTO_READ_COMPLETE_INSTRUCTION],src/renderer/components/ArtifactPopup.jsx,346,assertive,see message expression
live-announce,ArtifactPopup,Artifact popup interaction,"While auto-read is running, each chunk of the artifact description is spoken in sequence.",[chunk.text],src/renderer/components/ArtifactPopup.jsx,352,assertive,see message expression
live-announce,ArtifactPopup,Artifact popup interaction,Visitor moves to the next image in a multi-image artifact; NVDA announces the image number and alt text.,Image {next + 1} of {images.length}. {alt},src/renderer/components/ArtifactPopup.jsx,504,assertive,dynamic template
live-announce,ArtifactPopup,Artifact popup interaction,Visitor closes the transcript panel inside the artifact popup.,Transcript closed.,src/renderer/components/ArtifactPopup.jsx,511,assertive,
live-announce,ArtifactPopup,Artifact popup interaction,Visitor opens the guided description panel inside the artifact popup.,Guided description opened.,src/renderer/components/ArtifactPopup.jsx,519,assertive,
live-announce,ArtifactPopup,Artifact popup interaction,Visitor closes the guided description panel inside the artifact popup.,Guided description closed.,src/renderer/components/ArtifactPopup.jsx,524,assertive,
live-announce,ArtifactPopup,Artifact popup interaction,Visitor opens the transcript panel inside the artifact popup.,Transcript opened.,src/renderer/components/ArtifactPopup.jsx,532,assertive,
live-announce,ArtifactPopup,Artifact popup interaction,Visitor enters zoom mode on an artifact image; NVDA explains how to scroll the image.,Zoom mode. Snap up or down to see the image.,src/renderer/components/ArtifactPopup.jsx,540,assertive,
live-announce,ArtifactPopup,Artifact popup interaction,Visitor exits zoom mode and returns to the normal artifact popup.,Exited zoom mode.,src/renderer/components/ArtifactPopup.jsx,546,assertive,
live-announce,ArtifactPopup,Artifact popup interaction,A live-region announcement fires during ArtifactPopup interaction.,[label],src/renderer/components/ArtifactPopup.jsx,621,assertive,see message expression
live-announce,ArtifactPopup,Artifact popup interaction,A live-region announcement fires during ArtifactPopup interaction.,[label],src/renderer/components/ArtifactPopup.jsx,629,assertive,see message expression
live-announce,ArtifactPopup,Artifact popup interaction,Visitor moves to the next image in a multi-image artifact; NVDA announces the image number and alt text.,Top of image.,src/renderer/components/ArtifactPopup.jsx,794,assertive,
live-announce,ArtifactPopup,Artifact popup interaction,Visitor steps through the zoomed image one section at a time; NVDA announces the current step number.,Step {nextIndex + 1} of {totalSteps}.,src/renderer/components/ArtifactPopup.jsx,797,assertive,dynamic template
live-announce,ArtifactPopup,Artifact popup interaction,Visitor moves to the next image in a multi-image artifact; NVDA announces the image number and alt text.,Bottom of image.,src/renderer/components/ArtifactPopup.jsx,806,assertive,
live-announce,ArtifactPopup,Artifact popup interaction,Visitor steps through the zoomed image one section at a time; NVDA announces the current step number.,Step {nextIndex + 1} of {totalSteps}.,src/renderer/components/ArtifactPopup.jsx,809,assertive,dynamic template
aria-label,ArtifactPopup,Element receives focus,Artifact popup opens; NVDA reads the dialog label with the artifact title.,"{artifact.title}, artifact details",src/renderer/components/ArtifactPopup.jsx,849,n/a,dynamic template
aria-label,ArtifactPopup,Element receives focus,Visitor tabs to the left nav arrow in the artifact popup.,[dynamic],src/renderer/components/ArtifactPopup.jsx,865,n/a,"prevArtifact ? `Previous artifact: ${prevArtifact.displayTitle}` : ""Close artifact, return to theme"""
aria-label,ArtifactPopup,Element receives focus,Visitor tabs into the artifact control toolbar.,Artifact controls,src/renderer/components/ArtifactPopup.jsx,893,n/a,
aria-label,ArtifactPopup,Element receives focus,Visitor tabs to the next-image button (multi-image artifacts only).,Next image,src/renderer/components/ArtifactPopup.jsx,900,n/a,
aria-label,ArtifactPopup,Element receives focus,Visitor tabs to a control on the ArtifactPopup screen and NVDA reads this label.,Transcript,src/renderer/components/ArtifactPopup.jsx,912,n/a,
aria-label,ArtifactPopup,Element receives focus,Visitor tabs to a control on the ArtifactPopup screen and NVDA reads this label.,Guided description,src/renderer/components/ArtifactPopup.jsx,924,n/a,
aria-label,ArtifactPopup,Element receives focus,Visitor tabs to the Play/Zoom button; label switches between Play video and Zoom.,[dynamic],src/renderer/components/ArtifactPopup.jsx,939,n/a,"isVideo ? ""Play video"" : ""Zoom"""
aria-label,ArtifactPopup,Element receives focus,"With speech on, visitor tabs to the artifact title/description area and hears the full spoken label.",[dynamic],src/renderer/components/ArtifactPopup.jsx,955,n/a,speechMode ? speechLabel : undefined
aria-label,ArtifactPopup,Element receives focus,Visitor tabs to a control on the ArtifactPopup screen and NVDA reads this label.,Transcript,src/renderer/components/ArtifactPopup.jsx,971,n/a,
aria-label,ArtifactPopup,Element receives focus,Visitor tabs to Close inside the transcript or guided-description panel.,Close transcript,src/renderer/components/ArtifactPopup.jsx,978,n/a,
aria-label,ArtifactPopup,Element receives focus,Visitor tabs to a control on the ArtifactPopup screen and NVDA reads this label.,Guided description,src/renderer/components/ArtifactPopup.jsx,1003,n/a,
aria-label,ArtifactPopup,Element receives focus,Visitor tabs to a control on the ArtifactPopup screen and NVDA reads this label.,Close guided description,src/renderer/components/ArtifactPopup.jsx,1010,n/a,
aria-label,ArtifactPopup,Element receives focus,Visitor tabs to the right nav arrow in the artifact popup.,[dynamic],src/renderer/components/ArtifactPopup.jsx,1036,n/a,"nextArtifact ? `Next artifact: ${nextArtifact.displayTitle}` : ""Close artifact, return to theme"""
aria-label,ArtifactPopup,Element receives focus,Visitor enters zoom mode; NVDA reads the zoom dialog label.,Image zoom view,src/renderer/components/ArtifactPopup.jsx,1050,n/a,
aria-label,ArtifactPopup,Element receives focus,Visitor tabs into the zoom scroll toolbar.,Zoom scroll controls,src/renderer/components/ArtifactPopup.jsx,1063,n/a,
aria-label,ArtifactPopup,Element receives focus,Structural label for the snap-scroll arrow group in zoom mode.,Snap image view,src/renderer/components/ArtifactPopup.jsx,1064,n/a,
aria-label,ArtifactPopup,Element receives focus,Visitor tabs to the up-arrow in zoom mode.,Snap view up one step,src/renderer/components/ArtifactPopup.jsx,1071,n/a,
aria-label,ArtifactPopup,Element receives focus,Visitor tabs to the down-arrow in zoom mode.,Snap view down one step,src/renderer/components/ArtifactPopup.jsx,1081,n/a,
aria-label,ArtifactPopup,Element receives focus,Visitor tabs to Exit zoom mode in the zoom toolbar.,Exit zoom mode,src/renderer/components/ArtifactPopup.jsx,1087,n/a,
aria-label,ArtifactVideoOverlay,Element receives focus,Visitor plays a video artifact; the video overlay opens.,Artifact video player,src/renderer/components/ArtifactVideoOverlay.jsx,203,n/a,
aria-label,ArtifactVideoOverlay,Element receives focus,Video overlay shows a poster/thumbnail; NVDA reads the video alt text or 'Video preview'.,[dynamic],src/renderer/components/ArtifactVideoOverlay.jsx,215,n/a,"videoAlt || ""Video preview"""
aria-label,ArtifactVideoOverlay,Element receives focus,Visitor tabs into the video control toolbar.,Artifact video controls,src/renderer/components/ArtifactVideoOverlay.jsx,228,n/a,
aria-label,ArtifactVideoOverlay,Element receives focus,Visitor tabs to the play/pause button; label switches between Play video and Pause video.,[dynamic],src/renderer/components/ArtifactVideoOverlay.jsx,232,n/a,"isPlaying ? ""Pause video"" : ""Play video"""
aria-label,ArtifactVideoOverlay,Element receives focus,Visitor tabs to Open guided description in the video overlay.,Open guided description,src/renderer/components/ArtifactVideoOverlay.jsx,242,n/a,
aria-label,ArtifactVideoOverlay,Element receives focus,Visitor tabs to Open transcript in the video overlay.,Open transcript,src/renderer/components/ArtifactVideoOverlay.jsx,251,n/a,
aria-label,ArtifactVideoOverlay,Element receives focus,Visitor tabs to Close and leaves the video overlay.,Close video player,src/renderer/components/ArtifactVideoOverlay.jsx,259,n/a,
aria-label,ArtifactVideoOverlay,Element receives focus,Transcript or guided-description panel is open in the video overlay.,Transcript,src/renderer/components/ArtifactVideoOverlay.jsx,272,n/a,
aria-label,ArtifactVideoOverlay,Element receives focus,Visitor tabs to Close inside the transcript panel in the video overlay.,Close transcript,src/renderer/components/ArtifactVideoOverlay.jsx,279,n/a,
aria-label,ArtifactVideoOverlay,Element receives focus,Visitor tabs to a control on the ArtifactVideoOverlay screen and NVDA reads this label.,Guided description,src/renderer/components/ArtifactVideoOverlay.jsx,304,n/a,
aria-label,ArtifactVideoOverlay,Element receives focus,Visitor tabs to Close inside the guided-description panel.,Close guided description,src/renderer/components/ArtifactVideoOverlay.jsx,311,n/a,
helper-fn,AttractScene,Referenced by announce() or aria-label (ATTRACT_BRAILLE_LABEL_TEST),Internal braille-label test string — not used in the live visitor flow.,"Lorem ipsum dolor sit amet, consectetur adipiscing elit. Sed do eiusmod tempor incididunt ut labore et dolore magna aliqua. Ut enim ad minim veniam, quis nostrud exercitation ullamco laboris.",src/renderer/components/scenes/AttractScene.jsx,8,n/a,constant ATTRACT_BRAILLE_LABEL_TEST
aria-label,AttractScene,Element receives focus,Attract loop is showing; visitor focuses the attract screen and hears the welcome plus headphones reminder.,The Helen Keller Archives. Press any key to continue. Headphones are located to the right.,src/renderer/components/scenes/AttractScene.jsx,129,n/a,
helper-fn,HomeScene,Referenced by announce() or aria-label (HOME_HEADING_LABEL),Home page heading text used when speech mode is on (read on focus).,Choose a theme from Helen Keller's life journey. Use arrow keys to view themes. Press the select key to enter a theme. Use the home key to return to this page.,src/renderer/components/scenes/HomeScene.jsx,41,n/a,constant HOME_HEADING_LABEL
live-announce,HomeScene,Theme circle focused for 3s (speech mode),A live-region announcement fires during HomeScene interaction.,[message],src/renderer/components/scenes/HomeScene.jsx,78,assertive,see message expression
aria-label,HomeScene,Element receives focus,Visitor tabs to the help (?) button on Home and hears this label.,Watch instructional video for help navigating the controls,src/renderer/components/scenes/HomeScene.jsx,243,n/a,
aria-label,HomeScene,Element receives focus,Home page heading text used when speech mode is on (read on focus).,[dynamic],src/renderer/components/scenes/HomeScene.jsx,257,n/a,speechMode ? announceHomeArrival ? `Home. ${HOME_HEADING_LABEL}` : HOME_HEADING_LABEL : undefined
aria-label,HomeScene,Element receives focus,Structural label for the theme carousel (mostly hidden from sighted view).,Theme selection,src/renderer/components/scenes/HomeScene.jsx,281,n/a,
aria-label,HomeScene,Element receives focus,Visitor moves between theme circles with the arrow keys; each circle announces its name and position.,"{theme.label}, {i + 1} of {themes.length}",src/renderer/components/scenes/HomeScene.jsx,293,n/a,dynamic template
aria-label,HomeScene,Element receives focus,Visitor opens the help video overlay; NVDA reads the video dialog label.,Instructional video,src/renderer/components/scenes/HomeScene.jsx,322,n/a,
aria-label,HomeScene,Element receives focus,Visitor tabs to Close inside the help video overlay.,Close instructional video,src/renderer/components/scenes/HomeScene.jsx,330,n/a,
aria-label,InstructionScene,Element receives focus,Instruction video is playing; visitor tabs to Skip and hears this label.,Skip instructions,src/renderer/components/scenes/InstructionScene.jsx,92,n/a,
aria-label,QuoteScene,Element receives focus,Visitor selects a theme and sees the full-screen quote; NVDA reads the theme name plus 'theme quote'.,{theme.label} theme quote,src/renderer/components/scenes/QuoteScene.jsx,93,n/a,dynamic template
helper-fn,ThemeScene,Called by announce() (getThemeTipMessage),Template for the tip heard the first time a visitor enters any theme page.,"Tip: You are on the {themeLabel} theme page. Use the arrow keys to navigate between artifacts, and press the select key to learn more. Press the home button to choose a different theme.",src/renderer/components/scenes/ThemeScene.jsx,48,n/a,template
helper-fn,ThemeScene,Called by announce() (getThemePageAnnouncement),Template for the theme intro heard after the first-visit tip is dismissed.,{theme.label}. Use arrow keys to choose an artifact. {theme.description},src/renderer/components/scenes/ThemeScene.jsx,52,n/a,template
live-announce,ThemeScene,First visit to theme — tip or page intro,A live-region announcement fires during ThemeScene interaction.,[getThemeTipMessage(theme.label],src/renderer/components/scenes/ThemeScene.jsx,123,assertive,see message expression; source: theme-tip-show
live-announce,ThemeScene,First visit to theme — tip or page intro,A live-region announcement fires during ThemeScene interaction.,[text],src/renderer/components/scenes/ThemeScene.jsx,132,assertive,see message expression
aria-label,ThemeScene,Element receives focus,"On a theme page with speech on, visitor focuses the heading and hears the theme name, description, and navigation hint.",[dynamic],src/renderer/components/scenes/ThemeScene.jsx,305,n/a,speechMode ? `${theme.label}. Use arrow keys to choose an artifact. ${theme.description}` : undefined
aria-label,ThemeScene,Element receives focus,Structural label for the artifact bubble carousel.,Artifact selection,src/renderer/components/scenes/ThemeScene.jsx,334,n/a,
aria-label,VideoPlayer,Element receives focus,Help/instruction video overlay is open.,Video player,src/renderer/components/VideoPlayer.jsx,73,n/a,
aria-label,VideoPlayer,Element receives focus,Visitor tabs to Play in the instruction video player.,Play video,src/renderer/components/VideoPlayer.jsx,78,n/a,
aria-label,VideoPlayer,Element receives focus,Visitor tabs to Pause in the instruction video player.,Pause video,src/renderer/components/VideoPlayer.jsx,82,n/a,
aria-label,VideoPlayer,Element receives focus,Visitor tabs to Open transcript in the instruction video player.,Open transcript,src/renderer/components/VideoPlayer.jsx,97,n/a,
aria-label,VideoPlayer,Element receives focus,Visitor tabs to Open guided description in the instruction video player.,Open guided description,src/renderer/components/VideoPlayer.jsx,111,n/a,
aria-label,VideoPlayer,Element receives focus,Transcript panel is open in the instruction video player.,Transcript,src/renderer/components/VideoPlayer.jsx,119,n/a,
aria-label,VideoPlayer,Element receives focus,Visitor tabs to Close in the transcript panel.,Close transcript,src/renderer/components/VideoPlayer.jsx,130,n/a,
aria-label,VideoPlayer,Element receives focus,Guided description panel is open in the instruction video player.,Guided description,src/renderer/components/VideoPlayer.jsx,151,n/a,
aria-label,VideoPlayer,Element receives focus,Visitor tabs to Close in the guided description panel.,Close guided description,src/renderer/components/VideoPlayer.jsx,163,n/a,
live-announce,ZoomControls,Zoom / pan action,Visitor zooms in but is already at maximum zoom.,Maximum zoom.,src/renderer/components/ZoomControls.jsx,39,assertive,
live-announce,ZoomControls,Zoom / pan action,Visitor zooms in on an artifact image; NVDA announces the new zoom percentage.,Zoomed in. {Math.round((newScale - 1) * 100)} percent.,src/renderer/components/ZoomControls.jsx,45,assertive,dynamic template; source: ZoomControls
live-announce,ZoomControls,Zoom / pan action,Visitor zooms out but is already at minimum zoom.,Minimum zoom.,src/renderer/components/ZoomControls.jsx,59,assertive,
live-announce,ZoomControls,Zoom / pan action,Visitor zooms out on an artifact image; NVDA announces the new zoom percentage.,Zoomed out. {Math.round((newScale - 1) * 100)} percent.,src/renderer/components/ZoomControls.jsx,80,assertive,dynamic template; source: ZoomControls
live-announce,ZoomControls,Zoom / pan action,Visitor tries to pan up but has hit the top edge.,Top limit reached.,src/renderer/components/ZoomControls.jsx,101,assertive,
live-announce,ZoomControls,Zoom / pan action,Visitor pans the zoomed image upward.,Panned up.,src/renderer/components/ZoomControls.jsx,105,assertive,
live-announce,ZoomControls,Zoom / pan action,Visitor tries to pan down but has hit the bottom edge.,Bottom limit reached.,src/renderer/components/ZoomControls.jsx,109,assertive,
live-announce,ZoomControls,Zoom / pan action,Visitor pans the zoomed image downward.,Panned down.,src/renderer/components/ZoomControls.jsx,113,assertive,
live-announce,ZoomControls,Zoom / pan action,Visitor tries to pan left but has hit the left edge.,Left limit reached.,src/renderer/components/ZoomControls.jsx,117,assertive,
live-announce,ZoomControls,Zoom / pan action,Visitor pans the zoomed image left.,Panned left.,src/renderer/components/ZoomControls.jsx,121,assertive,
live-announce,ZoomControls,Zoom / pan action,Visitor tries to pan right but has hit the right edge.,Right limit reached.,src/renderer/components/ZoomControls.jsx,125,assertive,
live-announce,ZoomControls,Zoom / pan action,Visitor pans the zoomed image right.,Panned right.,src/renderer/components/ZoomControls.jsx,129,assertive,
live-announce,ZoomControls,Zoom / pan action,Visitor resets zoom so the image fits the screen again.,Reset. Fit to screen.,src/renderer/components/ZoomControls.jsx,154,assertive,
aria-label,ZoomControls,Element receives focus,Visitor tabs into the zoom/pan toolbar.,Zoom and pan controls,src/renderer/components/ZoomControls.jsx,203,n/a,
aria-label,ZoomControls,Element receives focus,Visitor tabs to Zoom in.,Zoom in,src/renderer/components/ZoomControls.jsx,213,n/a,
aria-label,ZoomControls,Element receives focus,Visitor tabs to Zoom out.,Zoom out,src/renderer/components/ZoomControls.jsx,225,n/a,
aria-label,ZoomControls,Element receives focus,Visitor tabs to Pan left.,Pan left,src/renderer/components/ZoomControls.jsx,240,n/a,
aria-label,ZoomControls,Element receives focus,Visitor tabs to Pan up.,Pan up,src/renderer/components/ZoomControls.jsx,253,n/a,
aria-label,ZoomControls,Element receives focus,Visitor tabs to Pan down.,Pan down,src/renderer/components/ZoomControls.jsx,265,n/a,
aria-label,ZoomControls,Element receives focus,Visitor tabs to Pan right.,Pan right,src/renderer/components/ZoomControls.jsx,278,n/a,
aria-label,ZoomControls,Element receives focus,Visitor tabs to Reset zoom.,Reset zoom,src/renderer/components/ZoomControls.jsx,288,n/a,
aria-label,ZoomControls,Element receives focus,Visitor tabs to Exit zoom mode.,Exit Zoom Mode,src/renderer/components/ZoomControls.jsx,296,n/a,
data-field,artifacts,Theme circle focused for 3s — Change (speech mode),"On Home with speech on, visitor pauses on the Change circle for 3 seconds and hears this summary.","Helen Keller was a lifelong advocate for voting, labor, economic rights, and disability rights. Press select key to view the artifacts in this theme.",src/renderer/data/artifacts.js,,n/a,"screenReaderBlurb for theme ""change""; expanded via getThemeFocusAnnouncement()"
data-field,artifacts,Theme circle focused for 3s — Together (speech mode),"On Home with speech on, visitor pauses on the Together circle for 3 seconds and hears this summary.",Helen Keller’s growth and accomplishments grew from friendships and collaboration across society and the world. Press select key to view the artifacts in this theme.,src/renderer/data/artifacts.js,,n/a,"screenReaderBlurb for theme ""together""; expanded via getThemeFocusAnnouncement()"
data-field,artifacts,Theme circle focused for 3s — Adventure (speech mode),"On Home with speech on, visitor pauses on the Adventure circle for 3 seconds and hears this summary.","Helen Keller traveled to 39 countries and even piloted a plane, inspiring people everywhere she went. Press select key to view the artifacts in this theme.",src/renderer/data/artifacts.js,,n/a,"screenReaderBlurb for theme ""adventure""; expanded via getThemeFocusAnnouncement()"
data-field,artifacts,Theme circle focused for 3s — Work (speech mode),"On Home with speech on, visitor pauses on the Work circle for 3 seconds and hears this summary.","From Vaudeville and Radcliffe College to Hollywood, Helen Keller pursued an extraordinarily diverse life of education and work. Press select key to view the artifacts in this theme.",src/renderer/data/artifacts.js,,n/a,"screenReaderBlurb for theme ""work""; expanded via getThemeFocusAnnouncement()"
helper-fn,artifacts,Called by announce() (getThemeFocusAnnouncement),Reusable copy used by artifacts; see trigger column for where it is called.,{blurb} Press select key to view the artifacts in this theme.,src/renderer/data/artifacts.js,574,n/a,template
live-announce,useSceneManager,Live-region announcement,A live-region announcement fires during useSceneManager interaction.,"[wasPaused ? ""Playing"" : ""Paused""]",src/renderer/state/useSceneManager.js,173,assertive,see message expression
